{
  "$schema": "http://json-schema.org/draft-07/schema#",
  "title": "Detector Rule",
  "type": "object",
  "properties": {
    "id": { "type": "string" },
    "name": { "type": "string" },
    "severity": { "type": "string", "enum": ["info","warning","error"] },
    "pattern": { "type": "string" },
    "description": { "type": "string" },
    "examples": { "type": "array", "items": { "type": "string" } },
    "allowlist_contexts": { "type": "array", "items": { "type": "string" } }
  },
  "required": ["id","name","severity"]
}
